{
  "structure_templates_version": "1",
  "note": "Named song structures as data. A template is a contract, not a label: the lyric generator is handed it as a writing brief, the composer instantiates its bar plan, and check_lyrics.py verifies the result against it. Sections are listed one entry per occurrence, in performance order, so sequence checking is a straight comparison.",
  "default_syllable_band": [
    6,
    10
  ],
  "assumptions": "Bar counts assume 4/4 and are the conventional shape for the form, not a law. Section bar counts at 8 and connective sections at 4 are the norm; a template's total bars divided by its tempo gives its duration, which is arithmetic and therefore belongs in code.",
  "templates": [
    {
      "id": "nu_metal_rap_rock",
      "name": "Nu-metal rap-rock",
      "summary": "Quiet-loud rap-rock: rapped verses, a building pre-chorus, a cathartic sung chorus, and a stripped bridge before the last one.",
      "typical_use": [
        "nu metal",
        "rap rock",
        "alternative metal",
        "industrial rock"
      ],
      "duration_range_s": [
        165,
        230
      ],
      "sections": [
        {
          "role": "intro",
          "bars": 8,
          "energy": 3,
          "energy_tags": [
            "et_building"
          ],
          "note": "Electronic build; no vocal.",
          "transition_out": "tt_drum_fill"
        },
        {
          "role": "verse",
          "bars": 16,
          "lines": 8,
          "rhyme_scheme": "internal",
          "energy": 3,
          "vocals": [
            "vt_rap"
          ],
          "energy_tags": [
            "et_driving",
            "et_urgent"
          ],
          "note": "Rapped, not shouted: the verse is rhythmic and controlled, and it is the section the ear can actually follow.",
          "transition_out": "tt_build"
        },
        {
          "role": "pre_chorus",
          "bars": 8,
          "lines": 4,
          "rhyme_scheme": "abcb",
          "energy": 4,
          "vocals": [
            "vt_sung",
            "vt_clean"
          ],
          "energy_tags": [
            "et_building",
            "et_urgent"
          ],
          "transition_out": "tt_stop"
        },
        {
          "role": "chorus",
          "bars": 8,
          "lines": 4,
          "rhyme_scheme": "aabb",
          "energy": 5,
          "hook": true,
          "vocals": [
            "vt_clean",
            "vt_melodic",
            "vt_harmonies"
          ],
          "energy_tags": [
            "et_anthemic"
          ],
          "note": "The chorus is the sung moment. Clean and melodic on top of loud guitars, wide and layered, not shouted.",
          "transition_out": "tt_downlifter"
        },
        {
          "role": "verse",
          "bars": 16,
          "lines": 8,
          "rhyme_scheme": "internal",
          "energy": 3,
          "vocals": [
            "vt_rap"
          ],
          "energy_tags": [
            "et_driving",
            "et_urgent"
          ],
          "transition_out": "tt_build"
        },
        {
          "role": "pre_chorus",
          "bars": 8,
          "lines": 4,
          "rhyme_scheme": "abcb",
          "energy": 4,
          "vocals": [
            "vt_sung",
            "vt_clean"
          ],
          "energy_tags": [
            "et_building",
            "et_urgent"
          ],
          "transition_out": "tt_riser"
        },
        {
          "role": "chorus",
          "bars": 8,
          "lines": 4,
          "rhyme_scheme": "aabb",
          "energy": 5,
          "hook": true,
          "vocals": [
            "vt_clean",
            "vt_melodic",
            "vt_harmonies"
          ],
          "energy_tags": [
            "et_anthemic"
          ],
          "transition_out": "tt_stop"
        },
        {
          "role": "bridge",
          "bars": 8,
          "lines": 4,
          "rhyme_scheme": "free",
          "energy": 2,
          "vocals": [
            "vt_clean",
            "vt_breathy"
          ],
          "energy_tags": [
            "et_stripped",
            "et_vulnerable"
          ],
          "note": "The quiet one, and the only place a ragged edge is wanted: a single voice, exposed, before the last chorus opens up.",
          "transition_out": "tt_riser"
        },
        {
          "role": "chorus",
          "bars": 8,
          "lines": 4,
          "rhyme_scheme": "aabb",
          "energy": 5,
          "hook": true,
          "vocals": [
            "vt_belting",
            "vt_gang"
          ],
          "energy_tags": [
            "et_anthemic",
            "et_release"
          ],
          "note": "Loudest chorus because the bridge was not. Belting over gang vocals, no harsh vocal needed.",
          "transition_out": "tt_crossfade"
        },
        {
          "role": "outro",
          "bars": 4,
          "energy": 4,
          "energy_tags": [
            "et_release"
          ],
          "note": "No vocal; the riff out."
        }
      ],
      "notes": "The form depends on dynamics, not on new material: the same chorus three times, the third one loud because the bridge was not. Rapped verses carry internal rhyme rather than end rhyme, so the rhyme check is asked for presence rather than pattern. Eight-line verses are twice a pop verse because a rap line moves at about one per bar, not one per two."
    },
    {
      "id": "pop_standard",
      "name": "Pop standard",
      "summary": "Two verses, a pre-chorus lift, a bridge, and a double chorus to finish.",
      "typical_use": [
        "contemporary pop",
        "R&B",
        "dance-pop"
      ],
      "duration_range_s": [
        150,
        240
      ],
      "sections": [
        {
          "role": "intro",
          "bars": 4,
          "optional": true,
          "energy": 2
        },
        {
          "role": "verse",
          "bars": 8,
          "lines": 4,
          "rhyme_scheme": "aabb",
          "energy": 2
        },
        {
          "role": "pre_chorus",
          "bars": 4,
          "lines": 4,
          "rhyme_scheme": "abab",
          "energy": 3
        },
        {
          "role": "chorus",
          "bars": 8,
          "lines": 4,
          "rhyme_scheme": "aabb",
          "energy": 4,
          "hook": true
        },
        {
          "role": "verse",
          "bars": 8,
          "lines": 4,
          "rhyme_scheme": "aabb",
          "energy": 2
        },
        {
          "role": "pre_chorus",
          "bars": 4,
          "lines": 4,
          "rhyme_scheme": "abab",
          "energy": 3
        },
        {
          "role": "chorus",
          "bars": 8,
          "lines": 4,
          "rhyme_scheme": "aabb",
          "energy": 4,
          "hook": true
        },
        {
          "role": "bridge",
          "bars": 4,
          "lines": 4,
          "rhyme_scheme": "abba",
          "energy": 3
        },
        {
          "role": "chorus",
          "bars": 8,
          "lines": 4,
          "rhyme_scheme": "aabb",
          "energy": 5,
          "hook": true
        },
        {
          "role": "outro",
          "bars": 4,
          "optional": true,
          "energy": 2
        }
      ],
      "notes": "The default when a brief names no form. The bridge is the only section that should sound new; the final chorus earns its extra energy from the arrangement rather than new words."
    },
    {
      "id": "verse_chorus",
      "name": "Verse-chorus",
      "summary": "The simplest useful form: two verses and two choruses, nothing between them.",
      "typical_use": [
        "indie rock",
        "folk",
        "punk",
        "short briefs"
      ],
      "duration_range_s": [
        110,
        180
      ],
      "sections": [
        {
          "role": "intro",
          "bars": 4,
          "optional": true,
          "energy": 2
        },
        {
          "role": "verse",
          "bars": 8,
          "lines": 4,
          "rhyme_scheme": "abcb",
          "energy": 2
        },
        {
          "role": "chorus",
          "bars": 8,
          "lines": 4,
          "rhyme_scheme": "aabb",
          "energy": 4,
          "hook": true
        },
        {
          "role": "verse",
          "bars": 8,
          "lines": 4,
          "rhyme_scheme": "abcb",
          "energy": 2
        },
        {
          "role": "chorus",
          "bars": 8,
          "lines": 4,
          "rhyme_scheme": "aabb",
          "energy": 4,
          "hook": true
        },
        {
          "role": "outro",
          "bars": 4,
          "optional": true,
          "energy": 2
        }
      ],
      "notes": "Use the forgiving ABCB scheme in the verses so the narrative is not bent to fit rhymes, and keep the chorus on a stricter scheme so it lands as the hook."
    },
    {
      "id": "verse_pre_chorus_chorus",
      "name": "Verse with a lift",
      "summary": "Verse, pre-chorus, chorus, twice, then out.",
      "typical_use": [
        "pop",
        "K-pop",
        "musical theatre",
        "anything needing a build"
      ],
      "duration_range_s": [
        130,
        200
      ],
      "sections": [
        {
          "role": "intro",
          "bars": 4,
          "optional": true,
          "energy": 2
        },
        {
          "role": "verse",
          "bars": 8,
          "lines": 4,
          "rhyme_scheme": "aabb",
          "energy": 2
        },
        {
          "role": "pre_chorus",
          "bars": 4,
          "lines": 4,
          "rhyme_scheme": "abab",
          "energy": 3
        },
        {
          "role": "chorus",
          "bars": 8,
          "lines": 4,
          "rhyme_scheme": "aabb",
          "energy": 4,
          "hook": true
        },
        {
          "role": "verse",
          "bars": 8,
          "lines": 4,
          "rhyme_scheme": "aabb",
          "energy": 2
        },